{
  "schemaVersion": "1.0.0",
  "id": "leitura-479bff33-7fcd-48e4-be9d-12cbd144fd52",
  "revision": 10,
  "unit": "mm",
  "geometry": "orthogonal-rectangles",
  "ceilingHeightMm": 2700,
  "provenance": {
    "kind": "declared",
    "referenceIds": []
  },
  "references": [],
  "rooms": [
    {
      "id": "c1",
      "name": "Sala",
      "widthMm": 4000,
      "depthMm": 3000,
      "xMm": 0,
      "yMm": 0,
      "walls": {
        "south": "c1-south",
        "east": "c1-east",
        "north": "c1-north",
        "west": "c1-west"
      },
      "provenance": {
        "kind": "declared",
        "referenceIds": []
      }
    },
    {
      "id": "c2",
      "name": "Quarto",
      "widthMm": 3000,
      "depthMm": 3000,
      "xMm": 4000,
      "yMm": 0,
      "walls": {
        "south": "c2-south",
        "east": "c2-east",
        "north": "c2-north",
        "west": "c2-west"
      },
      "provenance": {
        "kind": "declared",
        "referenceIds": []
      }
    },
    {
      "id": "c3",
      "name": "Cozinha",
      "widthMm": 4000,
      "depthMm": 2000,
      "xMm": 0,
      "yMm": 3000,
      "walls": {
        "south": "c3-south",
        "east": "c3-east",
        "north": "c3-north",
        "west": "c3-west"
      },
      "provenance": {
        "kind": "declared",
        "referenceIds": []
      }
    }
  ],
  "relations": [
    {
      "id": "rel-c1-east--c2-west",
      "kind": "adjacent",
      "wallA": "c1-east",
      "wallB": "c2-west",
      "provenance": {
        "kind": "declared",
        "referenceIds": []
      }
    },
    {
      "id": "rel-c1-north--c3-south",
      "kind": "adjacent",
      "wallA": "c1-north",
      "wallB": "c3-south",
      "provenance": {
        "kind": "declared",
        "referenceIds": []
      }
    }
  ],
  "openings": []
}
